{"adapter_contract_version":"v0","challenge_digest":"ce1f8c477a5d202eb7869d2328165177d31c458450d39ae070b67f9f4a32fa5b","challenge_id":"prf-005","evaluation_input":{"after":{"composition":"T2(T1(S0))","state":{"authorization_scope":"agent-A-and-B","id":"S2"},"step_results":[{"id":"T1","locally_admissible":true},{"id":"T2","locally_admissible":true}]},"before":{"protected_predicate":{"equals":"agent-A-only","path":"authorization_scope"},"state":{"authorization_scope":"agent-A-only","id":"S0"},"transforms":[{"id":"T1","locally_admissible":true},{"id":"T2","locally_admissible":true}]}},"evaluator":{"config_digest":"0ecdbc4fa8d8ef509c89e6a45c38771225808bbcb25ab362cbca014726bb153f","id":"local-ollama-repeated-qwen2.5-coder-7b","version":"ollama-0.15.2"},"protected_relation_profile":{"direction_policy":"ordered-composition","equivalence_policy":"composition-safe","identity_policy":"anchored","kind":"composed_semantic_validity","multiplicity_policy":"not-applicable","policy_version":"v0","relation_type_policy":"typed-exact","scope":"transformation-pipeline","universe":"declared_pipeline_states"},"protected_relation_profile_digest":"354cc500c9b4796f9ed2fdb0f8130fae3eba45e3da8ff45c8987957e15708173","schema":"protected-relation-external-adapter-request.v0"}
